{
  "schema_version": "dfc.v1",
  "event_id": "evt_fixture",
  "event_type": "aivcs.snapshot.created",
  "tenant_id": "lornu-ai",
  "repo": "stevedores-org/aivcs",
  "run_id": "run_123",
  "task_id": "task_456",
  "aivcs_ref": "aivcs:snapshot:snap_789",
  "data_fabric_event_id": "evt_123",
  "idempotency_key": "sha256:fixture",
  "source_system": "aivcs_api",
  "payload_ref": "r2://artifacts/fixture",
  "created_at": "2026-06-13T12:00:00Z",
  "metadata": {}
}
